{
 "university": "Indiana University Bloomington",
 "slug": "indiana-university-bloomington",
 "scraped_at": "2026-10-21",
 "departments": [
  {
   "name": "The Media School",
   "school": "College of Arts and Sciences",
   "directory_url": "https://mediaschool.indiana.edu/people/faculty/index.html",
   "phd_program_url": "https://mediaschool.indiana.edu/academics/graduate/phd/index.html",
   "phd_program_name": "Ph.D. in Media Arts & Sciences",
   "notes": "Directory is JS-rendered; roster built from the \"Full-Time Faculty\" filter view (?class=1, 78 cards) of the 206-card directory. Ranks taken from card/profile title text; the site has no rank filter. Professors of practice, teaching professors, lecturers, visiting and clinical faculty excluded."
  }
 ],
 "faculty": [
  {
   "name": "Akinwumi Adesokan",
   "title": "Professor, Cinema and Media Studies, and Department of Comparative Literature; Editor-in-Chief, Black Camera",
   "rank": "Professor",
   "department": "The Media School",
   "profile_url": "https://mediaschool.indiana.edu/people/profile.html?p=adesokan",
   "personal_url": null,
   "photo_url": "https://data.mediaschool.indiana.edu/people/wp-content/uploads/sites/4/2018/12/Akin-Adesokan-profile-700x467.jpg",
   "google_scholar_url": null,
   "research_areas": [
    "African Cinema",
    "Nollywood",
    "Globalization and Film",
    "Intersections of Print and Electronic Media",
    "Postcolonial Artistic and Intellectual Traditions",
    "Cultural Theory",
    "Writing"
   ],
   "bio": "I am a writer and scholar. My latest novel, South Side, was published in 2025, and my first critical study, Postcolonial Artists and Global Aesthetics (Indiana University Press, 2011), is a multi-disciplinary work which explores the generic and cultural consequences of globalization by focusing on conceptual patterns in Nollywood, African cinema, and postcolonial writings. The range of films, books, authors and artists that I analyze in the book includes continental Africa, the Caribbean, the Indian subcontinent, and the US. My more recent book, Everything Is Sampled (iupress.org) , examines key texts, processes, practices, and figures in the shifting modes of production and circulation of African artistic forms with a focus on digital culture as the most currently decisive setting for these changes. I engage in research, teaching, and writing that are diversely preoccupied with “the poetics of engaged expatriation.” This is the development of a style suited to the apprehension of an intellectual or social figure whose publics are present but scattered, whose subject is visible in its density, simultaneously resisting and courting representation because s/he does not simply inhabit the primary context of that work. I have attempted an exploration of this “poetics” in an essay on the cinema of the Malian/Mauritanian filmmaker, Abderrahmane Sissako, published in Screen , the journal of cinema, in 2010. Subsequently, I have co-edited Celebrating D. O.",
   "sources": [
    "department_profile"
   ],
   "notes": "Joint appointment with Department of Comparative Literature; listed as full-time Media School faculty."
  },
  {
   "name": "Katina Bitsicas",
   "title": "Associate Professor and Director, EcoMedia Lab",
   "rank": "Associate Professor",
   "department": "The Media School",
   "profile_url": "https://mediaschool.indiana.edu/people/profile.html?p=kbitsica",
   "personal_url": null,
   "photo_url": "https://data.mediaschool.indiana.edu/people/wp-content/uploads/sites/4/2025/08/katina-bitsica-700x467.jpg",
   "google_scholar_url": null,
   "research_areas": [
    "Video Installation Art",
    "BioArt",
    "Art and Science",
    "new media",
    "Death Studies",
    "Experimental Film",
    "Memory",
    "Interactive Media",
    "performance",
    "photography",
    "ecoart",
    "Science and Environmental Communication"
   ],
   "bio": "Katina Bitsicas is a Greek-American new media artist who utilizes video, installation, projection mapping, BioArt, EcoArt, photography, and performance in her artworks to translate grief, the archive, and memory through material, microscopic, and digital tools. Her works bridge an interdisciplinary connection between the arts and sciences, combining found materials and archives with photographic and microscopic imagery of natural ecosystems. Decay is reinterpreted through the lens of nature’s cyclical processes and then paralleled with grief, further exploring the science of decay and its relationship to material history. She has exhibited worldwide, including The Armory Show, Candela Books + Gallery, Plexus Projects, Wheaton Biennial curated by Legacy Russell, CADAF: Digital Art Month Paris, Torrance Art Museum, Hatch Art Center, Eye’s Walk Festival, 57th Dimitria Festival in Thessaloniki, HereArt, Art in Odd Places Orlando, Digital Graffiti Festival, Indie Memphis Film Festival, St. Louis International Film Festival, and New Orleans Film Festival. In 2022, her artist book Luci: The Girl with Four Hearts was published with Flower Press. Notable residencies include Open Air Media Festival, University of Arkansas-Fort Smith Windgate AiR, UCSF Library, Atlantic Center for the Arts, Prairie Ronde, and Hinge Arts at the Kirkbride. Katina received her BA from Kalamazoo College, Post-Bacc from SACI Florence, Italy, and MFA from the University of South Florida.",
   "sources": [
    "department_profile"
   ],
   "notes": null
  },
  {
   "name": "Nicholas Browning",
   "title": "Associate Professor of Public Relations",
   "rank": "Associate Professor",
   "department": "The Media School",
   "profile_url": "https://mediaschool.indiana.edu/people/profile.html?p=nickphd",
   "personal_url": "https://sites.google.com/site/nicholasbrowningphd/",
   "photo_url": "https://data.mediaschool.indiana.edu/people/wp-content/uploads/sites/4/2018/12/nickphd-1.jpg",
   "google_scholar_url": null,
   "research_areas": [
    "Ethics",
    "Corporate Social Responsibility",
    "Reputation Management",
    "Political Communication",
    "Public Relations",
    "Corporate Social Performance",
    "Organizational Advocacy",
    "Strategic Communication"
   ],
   "bio": "Overview\nDr. Browning teaches several undergraduate and graduate courses in the PR sequence. He co-authored the textbook Writing for Public Relations and Strategic Communication , to which he brings over a decade of experience teaching persuasive writing.\nOutside the classroom, Browning serves as associate editor of the Journal of Public Relations Research , the field’s preeminent academic journal. He is also the co-founder and director of IU’s Strategic Communication Research Lab, a collaborative effort among students and faculty to produce high-quality, original scholarship.\nBrowning labors as a researcher as well. His primary interests include business and communication ethics; corporate social responsibility; organizational advocacy and activism; and reputation and relationship management. His scholarship has been published in several respected outlets, including the Journal of Public Relations Research , Public Relations Review , Journalism & Mass Communication Quarterly , and the Journal of Media Ethics . He is also the co-editor of Sociopolitical Advocacy and the Role of Public Relations: Theoretical Developments and Emerging Perspectives on Corporate Social Advocacy and Related Constructs , a book that brings together a diverse group of scholars to provide comprehensive conceptualizations and discussions of key constructs related to prosocial communication through perspectives grounded in public relations, marketing, and communication theory.\nTeaching",
   "sources": [
    "department_profile"
   ],
   "notes": null
  },
  {
   "name": "Ivica Ico Bukvic",
   "title": "KIX Lab Director, Professor Media Arts and Production",
   "rank": "Professor",
   "department": "The Media School",
   "profile_url": "https://mediaschool.indiana.edu/people/profile.html?p=ibukvic",
   "personal_url": "http://ico.bukvic.net",
   "photo_url": "https://data.mediaschool.indiana.edu/people/wp-content/uploads/sites/4/2025/10/ico-bukvic-1.png",
   "google_scholar_url": null,
   "research_areas": [
    "Human-Computer Interaction (HCI)",
    "Human Computer Interaction Design",
    "Immersive Spatial Entertainment",
    "music composition",
    "Multimedia Production",
    "data visualization",
    "sonification",
    "Embodiment",
    "Education"
   ],
   "bio": "Ico (pronounced as Itso) Bukvic is a post-disciplinary creative exploring and building technologies for a better tomorrow. His current research trajectories consist of low-latency synchronous musical co-creation over distance, aural immersion and broadening of human cognitive bandwidth in automotive scenarios, large-scale digital signal processing, including spatialization, and data sonification, and enhancing K-12 education through integrated technology-mediated experiential learning. He believes in an integrative and holistic approach to creative scholarship, and a better future through culture and technology.\nBukvic received doctorate from the University of Cincinnati (2005) in computer music. After 19 years at Virginia Tech, in August 2025 he joined Indiana University as a professor in Media Arts and Production and the inaugural Director of the Kinetic Immersion and Extended Reality (KIX) Lab, where he looks forward to exploring novel approaches to digital storytelling and a study of human condition through technology. Areas of instruction include immersive audio and visuals, embodied interaction and game design, and their application in a broad array of scenarios, from health to entertainment, designed to improve the quality of life.",
   "sources": [
    "department_profile"
   ],
   "notes": null
  },
  {
   "name": "Cara Caddoo",
   "title": "Associate Professor, Cinema and Media Studies & Department of History",
   "rank": "Associate Professor",